{
    "$schema": "http://json-schema.org/draft-07/schema#",
    "title": "EmailServer",
    "description": "A schema to validate the EmailServer config file for QumuloEmail",
    "type": "object",
    "properties":
    {
        "from_addr": {"type": "string"},
        "to_addr": {"type": "string"},
        "login": {"type": "string"},
        "password": {"type": "string"},
        "server": {"type": "string", "format": "hostname"},
        "port": {"type": "integer"},
        "use": {"type": "string", "oneOf": [{"enum": ["tls", "ssl", "none"]}]},
        "default_timezone": {"type":  "string", "default": "UTC"},
        "default_language": {"type": "string", "default":  "en"}
    },
    "required":
    [
        "from_addr",
        "to_addr",
        "server",
        "port"
    ]
}
